Post_ID,Post_Code,Owner_ID,Likes,Time_Stamp,Tags,Caption
1759024516169752921,BhpT3pNgGFZ,7347078808,21,1523912084,"['#appalachia', '#atnobo2018', '#nobo2018', '#traillife', '#appalachiantrail', '#ice', '#hillside', '#hikertrash', '#wildweather', '#mountainweather', '#mountaintime', '#woods', '#forest', '#georgia']",Went to bed with tornado warnings and thunderstorms and woke up to snow and ice. Getting close to North Carolina.<br>.<br>.<br>#appalachia #atnobo2018 #nobo2018 #traillife #appalachiantrail #ice #hillside #hikertrash #wildweather #mountainweather #mountaintime #woods #forest #georgia
1759021804233473232,BhpTQLhgLzQ,7347078808,21,1523911761,"['#georgia', '#georgiaskies', '#atnobo2018', '#appalachiantrail', '#nobo2018', '#mountains', '#sunset']",A few days before the storms came through.<br>.<br>#georgia #georgiaskies #atnobo2018 #appalachiantrail #nobo2018 #mountains #sunset
1758943395411207331,BhpBbLngSSj,6635295034,203,1523902414,"['#atnobo2018', '#appalahiantrail', '#atclassof2018', '#thruhike', '#atthruhike', '#hikertrash', '#goodbyemaryland']","Maryland was a quick state. The first picture is leaving Maryland and each picture after was taken in Maryland / West Virginia<br>.<br>.<br>(1) Mason Dixon, MD/PA border<br>(2) Bridge out of Harpers Ferry, entering Maryland<br>(3) Gath’s Empty Tomb, feat. An existential ending (Read the story)<br>(4) Cool state park, feat. A museum with other cool Civil War ruins and stuff (Most of Maryland was old Civil War trails)<br>(5) A church<br>(6) The Washington monument<br>(7) A bridge<br>(8) View over Annapolis Rocks two mornings ago<br>(9) What most of yesterday looked like<br>.<br>.<br>#atnobo2018 #appalahiantrail #atclassof2018 #thruhike #atthruhike #hikertrash #goodbyemaryland"
1758349694868009162,Bhm6bs5hjDK,500648637,113,1523831639,"['#backpacking', '#thetrek', '#optoutside', '#hiking', '#camping', '#mountains', '#at2018', '#thruhike', '#hikerlife', '#atnobo2018', '#keepitwild', '#getoutside', '#neverstopexploring', '#hiketheat', '#dirtbag', '#hikerlife', '#traillife']",The open grassy balds of Little Hump Mountain and Hump Mountain were absolutely stunning. The warm breeze and the panoramic views combined for what has been some of the most peaceful hiking of the trail. Fantastic way to finish up North Carolina.<br>.<br>.<br>.<br>#backpacking #thetrek #optoutside #hiking #camping  #mountains #at2018 #thruhike #hikerlife #atnobo2018 #keepitwild #getoutside #neverstopexploring #hiketheat #dirtbag #hikerlife #traillife
1758045370792203730,Bhl1PNBFtXS,4108798594,67,1523795361,"['#atthruhike', '#appalachiantrail', '#atnobo2018', '#atthruhike2018', '#hikerlife', '#hiketheat', '#noblisters', '#toesocksornosocks', '#hikinggear']","Over one month and 300 miles into our AT thru-hike and not a single blister *knock on wood* all thanks to our @injinji toe liners! We have seen so many people out for days due to injuries regarding their feet already. These liners are the deal breaker for us!!! They keep our feet cool and truly wick away all moisture. We wear them with a wool sock like @smartwool or @darntoughvermont , they collect the moisture and create a friction barrier to prevent blisters. Highly recommend!! #atthruhike #appalachiantrail #atnobo2018 #atthruhike2018 #hikerlife #hiketheat #noblisters #toesocksornosocks #hikinggear"
1758031748573570935,BhlyI-Vlid3,4108798594,60,1523793737,"['#atthruhike', '#appalachiantrail', '#atnobo2018', '#atthruhike2018', '#optoutside', '#appalachiantrail2018', '#hikerlife', '#backpacking']","A photo next to a random rock that had the AT symbol because why not. Over 332 miles in, out of 2198. #atthruhike #appalachiantrail #atnobo2018 #atthruhike2018 #optoutside #appalachiantrail2018 #hikerlife #backpacking"
1758026021846996584,Bhlw1o6FVZo,4108798594,34,1523793054,"['#atthruhike', '#appalachiantrail', '#hikerlife', '#haircolor', '#atnobo2018', '#atthruhike2018']","It’s sad seeing graffiti on the trail but at least this is informative, and I’m sure it’s true. Thankfully we were just passing through, but it gave us a good laugh. 🌎🌲❤️ #atthruhike #appalachiantrail #hikerlife #haircolor #atnobo2018 #atthruhike2018"
1757775924139744358,Bhk3-PRFVxm,4108798594,50,1523763240,"['#atthruhike', '#appalachiantrail', '#hikerlife', '#hiketheat', '#atnobo2018', '#atthruhike2018']",Day 33: Today we hiked up and over Big Bald and are currently at mile 332 and are spending the night in Erwin. 🌎🌲❤️ #atthruhike #appalachiantrail #hikerlife #hiketheat #atnobo2018 #atthruhike2018
1757422322040830017,BhjnkpplfhB,4338158,187,1523721088,"['#appalachiantrail', '#snickerbear', '#tennessee', '#atnobo2018']",Somewhere between a dream and reality. 📍💕Tennessee. #appalachiantrail #snickerbear #tennessee #atnobo2018
1757418666921745746,Bhjmvdjgt1S,2534153189,619,1523720652,"['#appalachiantrail', '#georgiatomaine', '#atnobo2018', '#at2018', '#atthruhike', '#nopainnomaine', '#thruhiking', '#hikertrash', '#trekking', '#appalachiantrials', '#hikemoreworryless', '#ihike', '#getoutdoors', '#optoutside', '#forceofnature', '#trektheat', '#hyoh', '#hiking', '#adventure', '#hikingtrail', '#thruhike', '#wild', '#darntough', '#adventureanywhere', '#leavenotrace', '#takelessdomore', '#vandring', '#thruhikesyndicate', '#thruhikesyndicate2018']","“Because in the end you won’t remember the time spent in the office, or mowing your lawn. Climb that goddamn mountain.” - Jack Kerouac •••••••••••••••••••••••••••••••••••••••••••••••••••••••••••<br>The last couple of days I feel like the AT is taking me over every mountaintop possible. They don’t look tough from this vantage point but some days it has been straight up with my feet and calves screaming. The trail always rewards me with a beautiful view though. While some days hiking can feel like a chore I remind myself that I could be back behind a desk daydreaming about the trail instead of living my dream so I try to take joy in the tiniest flower along the trail or the little purple butterflies that are everywhere. •••••••••••••••••••••••••••••••••••••••••••••••••••••••••••<br>#appalachiantrail #georgiatomaine #atnobo2018 #at2018 #atthruhike #nopainnomaine #thruhiking #hikertrash #trekking #appalachiantrials #hikemoreworryless #ihike #getoutdoors #optoutside #forceofnature #trektheat #hyoh #hiking #adventure #hikingtrail #thruhike #wild #darntough #adventureanywhere #leavenotrace #takelessdomore #vandring #thruhikesyndicate #thruhikesyndicate2018"
1756983269603373794,BhiDvmNA3Li,24370573,61,1523668749,"['#walktheparks', '#atnobo', '#atnobo2018', '#gear', '#backpacking', '#hiking', '#thruhiking', '#lifeisgood']","All my gear failing at once: stove, tent, sleeping bag, pack, sleeping pad, poles! They’ve all lived long lives though! #walktheparks #atnobo #atnobo2018 #gear #backpacking #hiking #thruhiking #lifeisgood"
1756965947144561728,Bhh_zhaAmRA,7347078808,28,1523666684,"['#naturescanvas', '#appalachiantrail', '#atnobo2018', '#nobo2018', '#georgia', '#walkwithtarzan', '#naturedaily', '#forest', '#wilderness', '#walkwithtarzan', '#appalachia', '#mountain', '#trailviews']",The views are like paintings.<br>.<br>.<br>#naturescanvas #appalachiantrail #atnobo2018 #nobo2018 #georgia #walkwithtarzan #naturedaily #forest #wilderness #walkwithtarzan #appalachia #mountain #trailviews
1756943283702349688,Bhh6publj94,4108798594,58,1523663982,"['#atthruhike', '#atnobo2018', '#appalachiantrail', '#hikerlife', '#hiketheat', '#couplegoals', '#whiteblaze']","Day 32: Today it was in the 70’s and was by far the hottest day so far. More ups, and we saw our third snake (sorry no photo of the second 🙁) a lot more open fields and still no leaves on the trees so we are working on our hiker tans too! 😝🌎🌲❤️ #atthruhike #atnobo2018 #appalachiantrail #hikerlife #hiketheat #couplegoals #whiteblaze"
1756934966598907277,Bhh4wshlzWN,4108798594,50,1523662990,"['#atnobo2018', '#atthruhike', '#appalachiantrail', '#hikerlife', '#hiketheat', '#300miles', '#couplegoals']",One month and over 300 miles in. Don’t worry we are picking up speed and have been averaging over 15 miles a day and 20 will be a breeze soon.  One foot in front of the other. 🙂🌎🌲❤️⛺️ #atnobo2018 #atthruhike #appalachiantrail #hikerlife #hiketheat #300miles #couplegoals
1756930777343422704,Bhh3zu-gXDw,6635295034,201,1523662491,"['#atnobo2018', '#appalachiantrail', '#atclassof2018', '#harpersferry', '#thruhike', '#hikertrash']","(1) My photo at the ATC headquarters—Number 13 (NOBO) on Friday the 13th—Couldn’t be better<br>(2) Eh, roughly half way<br>(3) The bridge into Harpers Ferry, WV<br>(4) Little gnome scenery on trail<br>(5) Potomac River<br>.<br>.<br>#atnobo2018 #appalachiantrail #atclassof2018 #harpersferry #thruhike #hikertrash"
1756601924557286325,BhgtCS9ASu1,7347078808,14,1523623289,"['#bluemountainshelter', '#georgia', '#atnobo2018', '#nobo2018', '#walkwithtarzan', '#fire', '#flames🔥', '#fireside', '#happyplace', '#appalachia', '#overmile50']",This is what dreams are made of. I've been falling asleep to coyotes fighting over food every night.<br>.<br>.<br>#bluemountainshelter #georgia #atnobo2018 #nobo2018 #walkwithtarzan #fire #flames🔥 #fireside #happyplace #appalachia #overmile50
1756230914721056731,BhfYrZHggfb,7347078808,11,1523579061,"['#appalachia', '#atnobo2018', '#nobo2018', '#walkwithtarzan', '#georgia', '#traillife', '#goodnightsun', '#appalachiantrail', '#4degreesnorth']","Our National Parks and Protected Lands are enormously beautiful and captivating. We are lucky, those of us who get the privilege to pursue these adventures.<br>.<br>.<br>#appalachia #atnobo2018 #nobo2018 #walkwithtarzan @ospreypacks @lekiusa @asolo_lifestyle #georgia #traillife #goodnightsun #appalachiantrail #4degreesnorth"
1756226256183000233,BhfXnmhAHyp,7347078808,9,1523578630,"['#hammockswinging', '#bluemountainshelter', '#atnobo2018', '#nobo2018', '#appalachia', '#appalachiantrail', '#hammockcamping', '#tarzan', '#walkwithtarzan', '#traillife', '#georgia']",#hammockswinging at #bluemountainshelter.<br>.<br>.<br>.<br>#atnobo2018 #nobo2018 #appalachia #appalachiantrail @enohammocks #hammockcamping #tarzan #walkwithtarzan #traillife @crocs #georgia
1756224851636513372,BhfXTKbgepc,7347078808,10,1523578338,"['#lowgap', '#springhassprung', '#appalachia', '#atnobo2018', '#nobo2018', '#appalachiantrail', '#woodedwaterfall', '#waterfall', '#forest', '#georgiaforest', '#flowers', '#hellospring', '#walkwithtarzan', '#4degreesnorth']",Passed #lowgap today. #springhassprung here in #appalachia.<br>.<br>.<br>#atnobo2018 #nobo2018 #appalachiantrail #woodedwaterfall #waterfall #forest #georgiaforest #flowers #hellospring #walkwithtarzan #4degreesnorth
1756224697521001774,BhfXQ65gdUu,6635295034,222,1523578320,"['#atnobo2018', '#appalachiantrail', '#atclassof2018', '#hikertrash', '#thruhike', '#byevirginia', '#helloharpersferry', '#abouthalfway']","(1) 4 states down, 10 to go<br>(2) Crossed the 1,000 mile mark today with Big Tuna (@old_man_harland)—Been walking with this dude for ~500 miles—Cheers to many more<br>(3) A bald<br>(4) A bench<br>.<br>.<br>#atnobo2018 #appalachiantrail #atclassof2018 #hikertrash #thruhike #byevirginia #helloharpersferry #abouthalfway"
1756221483342001576,BhfWiJdgnWo,7347078808,6,1523577937,"['#georgia', '#atnobo2018', '#nobo2018', '#appalachia', '#mouse', '#mice', '#babymouse', '#acorn', '#appalachiantrail', '#cutemouse', '#tarzantalkstocritters']",Mouse buddy 🐭.<br>.<br>.<br>#georgia #atnobo2018 #nobo2018 #appalachia #mouse #mice #babymouse #acorn #appalachiantrail #cutemouse #tarzantalkstocritters
1755914673595920668,BheQxenlLEc,4108798594,23,1523541362,"['#atthruhike', '#atnobo2018', '#appalachiantrail', '#hikerlife', '#hiketheat', '#whatisthis']",Does anyone know what this coin is?!? We got it out of a quarter machine in Hot Springs and cannot figure out where it might be from. Do you know? #atthruhike #atnobo2018 #appalachiantrail #hikerlife #hiketheat #whatisthis
1755890225256976472,BheLNtVBdBY,500648637,161,1523538448,"['#backpacking', '#thetrek', '#optoutside', '#hiking', '#camping', '#mountains', '#at2018', '#thruhike', '#hikerlife', '#atnobo2018', '#keepitwild', '#getoutside', '#neverstopexploring', '#hiketheat', '#dirtbag', '#hikerlife', '#traillife']","It's just one foot in front of the other, 40,000 times each day. 343 miles in, the routines of a life on trail have begun to feel normal. It's not a bad life.<br>.<br>.<br>.<br>#backpacking #thetrek #optoutside #hiking #camping  #mountains #at2018 #thruhike #hikerlife #atnobo2018 #keepitwild #getoutside #neverstopexploring #hiketheat #dirtbag #hikerlife #traillife"
1755865952282685427,BheFsfXAy_z,7347078808,8,1523535554,"['#appalachiantrail', '#4degreesnorth', '#atnobo2018', '#nobo2018', '#hogpengap', '#stilltrekking', '#gnomes', '#ibelieve', '#forrestadventures', '#forrest', '#walkwithtarzan']",Gnome Village. The random things you happen upon on the #appalachiantrail.<br>.<br>.<br>#4degreesnorth #atnobo2018 #nobo2018 #hogpengap #stilltrekking #gnomes #ibelieve #forrestadventures #forrest #walkwithtarzan
1755552964250051648,Bhc-h6igiRA,24370573,71,1523498243,"['#atnobo2018', '#atnobo', '#appalachiantrail', '#walktheparks', '#fire', '#backpacking', '#hiking', '#campfire']","Fires have been great out here, it’s been cold!  #atnobo2018 #atnobo #appalachiantrail #walktheparks #fire #backpacking #hiking #campfire"
1755546195743596737,Bhc8_a4FeDB,7095020456,15,1523497436,"['#chasingblazes', '#AT2018', '#appalachiantrail', '#appalachiantrail2018', '#atthruhike', '#thruhike2018', '#georgiatomaine', '#atnobo2018', '#thetrek', '#trektheat']",I can’t get enough 🌿 #chasingblazes#AT2018#appalachiantrail#appalachiantrail2018#atthruhike#thruhike2018#georgiatomaine#atnobo2018#thetrek#trektheat
1755544856326253626,Bhc8r7clyw6,7095020456,20,1523497276,"['#chasingblazes', '#AT2018', '#appalachiantrail', '#appalachiantrail2018', '#atthruhike', '#thruhike2018', '#georgiatomaine', '#atnobo2018', '#thetrek', '#trektheat']",Our view we were rewarded with on the top of the fire tower on Albert Mountain ⛰ #chasingblazes#AT2018#appalachiantrail#appalachiantrail2018#atthruhike#thruhike2018#georgiatomaine#atnobo2018#thetrek#trektheat
1755542021991685406,Bhc8CrxFd0e,7095020456,16,1523497073,"['#chasingblazes', '#AT2018', '#appalachiantrail', '#appalachiantrail2018', '#atthruhike', '#thruhike2018', '#georgiatomaine', '#atnobo2018', '#thetrek', '#trektheat']",Resupply day 🛒 #chasingblazes#AT2018#appalachiantrail#appalachiantrail2018#atthruhike#thruhike2018#georgiatomaine#atnobo2018#thetrek#trektheat
1755540872483912376,Bhc7x9NFTq4,7095020456,13,1523496801,"['#chasingblazes', '#AT2018', '#appalachiantrail', '#appalachiantrail2018', '#atthruhike', '#thruhike2018', '#georgiatomaine', '#atnobo2018', '#thetrek', '#trektheat']",I still can’t get over seeing tulips in every town we stop in. We don’t see many in Florida and I get so excited every time I see some!! 🌷 #chasingblazes#AT2018#appalachiantrail#appalachiantrail2018#atthruhike#thruhike2018#georgiatomaine#atnobo2018#thetrek#trektheat
1755498114264225552,BhcyDvgllcQ,4108798594,20,1523491704,"['#atthruhike', '#atnobo2018', '#appalachiantrail', '#hikerlife', '#hiketheat', '#hotsprings', '#appalachiantrail2018']","Goodbye Hot Springs! Thank you for the great food and warm bed! What a lovely little town, and how cool to have the AT literally run down their sidewalk. #atthruhike #atnobo2018 #appalachiantrail #hikerlife #hiketheat #hotsprings #appalachiantrail2018"
1755496739631821830,BhcxvvSHHQG,254241442,98,1523491540,"['#smidgehikestheat', '#appalachiantrail2018', '#atthruhike2018', '#atnobo2018', '#gsmnp']","Day 20: entered Great Smoky Mountains National Park today. It’s gorgeous 😍 Also, for discussion: what’s worse- egg farts or onion sweat? #smidgehikestheat #appalachiantrail2018 #atthruhike2018 #atnobo2018 #gsmnp"
1755373720945533926,BhcVxlNA6Pm,253198210,80,1523476875,"['#appalachiantrail2018', '#hike', '#northcarolina', '#thruhike', '#atnobo2018']",Sunrise and sunset from the top of Siler Bald in NC #appalachiantrail2018 #hike #northcarolina #thruhike #atnobo2018
1755256784840613466,Bhb7L7-BN5a,500648637,123,1523462936,"['#backpacking', '#thetrek', '#optoutside', '#hiking', '#camping', '#mountains', '#at2018', '#thruhike', '#hikerlife', '#atnobo2018', '#keepitwild', '#getoutside', '#neverstopexploring', '#hiketheat', '#dirtbag', '#hikerlife', '#traillife']","Ahhhh shit this shit again. The trail was mud and the air cold, but the promise of approaching warm weather kept spirits high. Snowman by Easy Pete.<br>.<br>.<br>.<br>#backpacking #thetrek #optoutside #hiking #camping  #mountains #at2018 #thruhike #hikerlife #atnobo2018 #keepitwild #getoutside #neverstopexploring #hiketheat #dirtbag #hikerlife #traillife"
1754779558006295828,BhaOrX2FQ0U,4108798594,26,1523412079,"['#atthruhike', '#atnobo2018', '#appalachiantrail', '#hikerlife', '#hiketheat', '#campfire', '#fire']",Campfires all day everyday! What a lovely evening 🌎🌲❤️⛺️⛰ #atthruhike #atnobo2018 #appalachiantrail #hikerlife #hiketheat #campfire #fire
1754814492623149858,BhaWnvPgpsi,7347078808,2,1523410210,"['#atnobo2018', '#nobo2018', '#appalachia', '#neelgap', '#boottree', '#suckers', '#dontgiveup', '#keepwalking', '#walkwithtarzan', '#4degreesnorth', '#yougetscaredyougetstuck']",Made it to Neel Gap today. Did not throw our boots up. We're not giving up or in!<br>#atnobo2018 #nobo2018 #appalachia #neelgap #boottree #suckers #dontgiveup #keepwalking #walkwithtarzan #4degreesnorth #yougetscaredyougetstuck
1754813022712544796,BhaWSWSAr4c,7347078808,6,1523410035,"['#BloodMountain', '#appalachia', '#atnobo2018', '#nobo2018', '#appalachiantrail', '#followme', '#walkwithtarzan', '#4degreesnorth', '#mountainviews', '#rolling']",Views from the day we summited #BloodMountain  #appalachia #atnobo2018 #nobo2018 #appalachiantrail #followme #walkwithtarzan #4degreesnorth #mountainviews #rolling
1754774960921990969,BhaNoeegVc5,6635295034,174,1523405498,"['#atnobo2018', '#appalachiantrail', '#atclassof2018', '#atthruhike', '#hikertrash', '#shenandoahnationalpark', '#wintershouldbeover']","(1) A cool portion of trail in the first half of Shenandoah’s<br>(2) Some of the best weather we’ve had, this day<br>(3) Something out of the Lion King<br>(4) Communication towers<br>(5) Closest I’ve ever been to deer, a video<br>(6) La Copa (@gepstein79) & Big Tuna (@old_man_harland), watching the snow fall down<br>(7) More snow. Yay<br>(8) Almost a view<br>(9) Shot over Blue Ridge Parkway, leaving Shenandoah’s<br>.<br>.<br>#atnobo2018 #appalachiantrail #atclassof2018 #atthruhike #hikertrash #shenandoahnationalpark #wintershouldbeover"
1754674389028204847,BhZ2w9mgHEv,253198210,62,1523393509,"['#appalachiantrail2018', '#eat', '#hike', '#sleep', '#repeat', '#backpack', '#backpacking', '#backpackerstory', '#atnobo2018', '#atthruhike2018', '#atthruhike', '#northbound', '#mtalbert']","Day 9 + 10 - WE HAVE HIKED OUR FIRST 100 miles! ⛰💥🙌🏼 I k ow it doesn’t seem like much when you think about us hiking another 22 of those, but it feels awesome to us. We got to the top of Mt Albert yesterday, after hiking most of the day in fog and rain. The climb to the top is a class two scramble, very rocky and we couldn’t see much from the top because of fog, but we felt great getting to the top and giving @brucemfallis and @fallismarcia a call to let the know we made it 🏆 we set camp that night and washed up. We had a dry cold night, which felt great coming off several wet cold days/nights. The sun was out our tent was pretty dry and we enjoyed a day of seeing our shadows and hiking with a fellow hiker for most of the afternoon. Getting to hear other people’s stories about life, about what brought them to this journey is a part of the time I enjoy most. We learn from each other and we get to laugh together. We are ending our day atop Siler Bald, we have a 360 degree view so we should see a beautiful sunset and sunrise 🏕🌄🌅 Can’t wait to share! #appalachiantrail2018 #eat #hike #sleep #repeat #backpack #backpacking #backpackerstory #atnobo2018 #atthruhike2018 #atthruhike #northbound #mtalbert"
1754590163956247208,BhZjnU5Aaqo,707809266,29,1523383468,"['#atnobo2018', '#zpacks', '#appalachiantrail', '#atclassof2018']","My son, on the AT. If you are not following his journey you are missing out. Follow him @a_connor_outdoors  #atnobo2018 #zpacks. #appalachiantrail #atclassof2018"
1754566091748121313,BhZeJB5l5rh,4108798594,49,1523380948,"['#atthruhike', '#atnobo2018', '#appalachiantrail', '#hikerlife', '#hiketheat', '#iceontrees', '#fallingice']","Ice covered trees were falling on us all day. What a surprise when they hit us right on the head, knuckles, and even a few right down the neck! 😝#atthruhike #atnobo2018 #appalachiantrail #hikerlife #hiketheat #iceontrees #fallingice"
1754086919518911340,BhXxMJ_FXts,4108798594,49,1523323477,"['#appalachiantrail', '#atnobo2018', '#atthruhike', '#hikerlife', '#hiketheat', '#maxpatch', '#mountains', '#couplegoals']","Max patch was beyond beautiful!! We really wanted to stay for the sunrise, or sunset but it was far too cold. 🌎🌲❤️⛰⛺️ #appalachiantrail #atnobo2018 #atthruhike #hikerlife #hiketheat #maxpatch #mountains #couplegoals"
1754079845966470304,BhXvlOOgNyg,7347078808,13,1523322633,"['#frosty', '#atnobo2018', '#nobo2018', '#appalachia', '#appalachiantrail', '#wheresspring', '#hikertrash', '#coldmornings', '#frozentrees', '#frostedtips', '#4degreesnorth']",@walkwithtarzan on the Appalachian Trail. #frosty on Saturday April 7th.  #atnobo2018 #nobo2018 #appalachia #appalachiantrail #wheresspring #hikertrash #coldmornings #frozentrees #frostedtips #4degreesnorth
1754074139070781826,BhXuSLRA1mC,7347078808,20,1523321953,"['#atnobo2018', '#nobo2018', '#appalachiantrail', '#thruhiker', '#hikertrash', '#ospreypacks', '#georgia', '#walkwithtarzan', '#4degreesnorth', '#foggysunset', '#forestsunset', '#forest']",The rain has been relentless and our camp has been a paradise. #atnobo2018 #nobo2018 #appalachiantrail #thruhiker #hikertrash #ospreypacks @thenorthface @enohammocks #georgia #walkwithtarzan #4degreesnorth #foggysunset #forestsunset #forest
1754057604160910929,BhXqhj7lXZR,4108798594,35,1523319982,"['#appalachiantrail', '#atnobo2018', '#atthruhike', '#hikerlife', '#hiketheat', '#mountains', '#optoutside', '#at', '#atthruhike']","So crazy to be back on the AT again. It’s been so awesome re-visiting some pretty cool places. Over 274 miles in, hanging out in Hot Springs tonight. #appalachiantrail #atnobo2018 #atthruhike #hikerlife #hiketheat #mountains #optoutside #at #atthruhike"
1754053946442581887,BhXpsValQd_,4108798594,31,1523319546,"['#appalachiantrail', '#atnobo2018', '#atthruhike', '#hikerlife', '#hiketheat', '#optoutside', '#mountains']",Another view from Snowbird Mountain ⛰ 🌎🌲❤️ #appalachiantrail #atnobo2018 #atthruhike #hikerlife #hiketheat #optoutside #mountains
1754052777733449808,BhXpbU-FuhQ,4108798594,29,1523319407,"['#appalachiantrail', '#atnobo2018', '#atthruhike', '#hikerlife', '#hiketheat', '#mountains']",Snowbird Mountain #appalachiantrail #atnobo2018 #atthruhike #hikerlife #hiketheat #mountains
1754040247854268302,BhXmk_nF3-O,4108798594,29,1523317913,"['#appalachiantrail', '#atnobo2018', '#atthruhike', '#charliesbunion', '#smokeymountains', '#yolo', '#hikerlife', '#hiketheat']",Charlie’s Bunion was so amazing!! It was so great to have something so exciting to look forward too after a wonderful time in Gatlinburg! #appalachiantrail #atnobo2018 #atthruhike #charliesbunion #smokeymountains #yolo #hikerlife #hiketheat
1754018950562475429,BhXhvE9lG2l,4108798594,57,1523315374,"['#appalachiantrail', '#atnobo2018', '#atthruhike', '#hikerlife', '#hiketheat', '#thruhike']",Our day at Standing Bear was amazing! What a great place for us to dry off and warm up! It sure has been cold. 🌎🌲❤️ #appalachiantrail #atnobo2018 #atthruhike #hikerlife #hiketheat #thruhike
1753976054266364017,BhXX-2rFoBx,7095020456,22,1523310261,"['#chasingblazes', '#AT2018', '#appalachiantrail', '#appalachiantrail2018', '#atthruhike', '#thruhike2018', '#georgiatomaine', '#atnobo2018', '#thetrek', '#trektheat']",🐻 #chasingblazes#AT2018#appalachiantrail#appalachiantrail2018#atthruhike#thruhike2018#georgiatomaine#atnobo2018#thetrek#trektheat
1753970230794087628,BhXWqHJF2zM,7095020456,35,1523309566,"['#chasingblazes', '#AT2018', '#appalachiantrail', '#appalachiantrail2018', '#atthruhike', '#thruhike2018', '#georgiatomaine', '#atnobo2018', '#thetrek', '#trektheat']",We hit a major milestone this week! We have officially hiked over 100 miles! It’s such a crazy thing to wrap your head around. It sounds like such a big number when it really doesn’t feel like a lot. It caught me by surprise yesterday on our last big mileage day before town. To think back on the last two weeks with all the ups and downs we’ve had physically and mentally. I’m so thankful for how far we’ve come and excited for all the rest! #chasingblazes#AT2018#appalachiantrail#appalachiantrail2018#atthruhike#thruhike2018#georgiatomaine#atnobo2018#thetrek#trektheat
