Post_ID,Post_Code,Owner_ID,Likes,Time_Stamp,Tags,Caption
1796956314959475980,BjwEj9uDfUM,175590940,30,1528433907,"['#atthruhike', '#atthruhike2018', '#atclassof2018', '#appalachiantrail', '#atnobo', '#atnobo2018']","Awesome day at Dismal Falls! I caught up with my number one, @alasmind. We’ve been playing a 560 mile game of leap frog and I’m finally in the lead. I’m hoping he’ll catch up with me so we can hike together just like the good old days back in Georgia! #atthruhike #atthruhike2018 #atclassof2018 #appalachiantrail #atnobo #atnobo2018"
1796954041118115518,BjwEC4CjEa-,175590940,47,1528433636,"['#atthruhike', '#atthruhike2018', '#atclassof2018', '#appalachiantrail', '#atnobo', '#atnobo2018']",600 miles and I’m tired now. #atthruhike #atthruhike2018 #atclassof2018 #appalachiantrail #atnobo #atnobo2018
1796953328245807334,BjwD4gIDBjm,175590940,20,1528433551,"['#atthruhike', '#atthruhike2018', '#atclassof2018', '#appalachiantrail', '#atnobo', '#atnobo2018']",#atthruhike #atthruhike2018 #atclassof2018 #appalachiantrail #atnobo #atnobo2018
1796953075966826173,BjwD01LDFa9,175590940,16,1528433521,"['#atthruhike', '#atthruhike2018', '#atclassof2018', '#appalachiantrail', '#atnobo', '#atnobo2018']",#atthruhike #atthruhike2018 #atclassof2018 #appalachiantrail #atnobo #atnobo2018
1796952285047013126,BjwDpUkjb8G,175590940,39,1528433426,"['#atthruhike', '#atthruhike2018', '#atclassof2018', '#appalachiantrail', '#atnobo', '#atnobo2018']",Already a quarter of the way through this 2190 mile trail. I’ve learned a lot along the way and have become more and more comfortable with this lifestyle everyday. I’ve had a lot of doubt in my mind in the past two months but I find that those thoughts come less often now. The miles come easier and I’ve found an excellent group of people that won’t let me camp alone anymore. I am so excited to discover everything else that this trail has to offer me. #atthruhike #atthruhike2018 #atclassof2018 #appalachiantrail #atnobo #atnobo2018
1796948800310112609,BjwC2nKDHFh,175590940,32,1528433011,"['#atthruhike', '#atthruhike2018', '#atclassof2018', '#appalachiantrail', '#atnobo', '#atnobo2018']",Sometimes we hike and sometimes we take ridiculous side trails to see alpacas. #atthruhike #atthruhike2018 #atclassof2018 #appalachiantrail #atnobo #atnobo2018
1796947953950003036,BjwCqS7Dg9c,175590940,38,1528432910,"['#atthruhike', '#atthruhike2018', '#atclassof2018', '#appalachiantrail', '#atnobo', '#atnobo2018', '#tramily']","I feel like when I’m around them, there’s always a constant giggle coming from someone. Backwards Strike Team of the Haiku Crew. ❤️ #atthruhike #atthruhike2018 #atclassof2018 #appalachiantrail #atnobo #atnobo2018 #tramily"
1796943126884920051,BjwBkDXjirz,175590940,20,1528432335,"['#atthruhike', '#atthruhike2018', '#atclassof2018', '#appalachiantrail', '#atnobo', '#atnobo2018']",How to tell where the hikers are staying #atthruhike #atthruhike2018 #atclassof2018 #appalachiantrail #atnobo #atnobo2018
1796876928528144092,BjvygvWA9bc,175590940,31,1528424443,"['#atthruhike', '#atthruhike2018', '#atclassof2018', '#appalachiantrail', '#atnobo', '#atnobo2018']",Fog and wild ponies in the Grayson Highlands! #atthruhike #atthruhike2018 #atclassof2018 #appalachiantrail #atnobo #atnobo2018
1796533387683455430,BjukZkAAGHG,24370573,101,1528383490,"['#walktheparks', '#winning', '#westvirginia', '#virginia', '#atnobo2018', '#thruhike', '#appalachiantrail', '#appalachianmountains', '#yay']","Conquered Virginia and hiked over 1,000 miles on the AT!!!! #walktheparks #winning #westvirginia #virginia #atnobo2018 #thruhike #appalachiantrail #appalachianmountains #yay"
1795996481590579181,BjsqUjPDs_t,6635295034,234,1528319486,"['#atnobo2018', '#appalachiantrail', '#atclassof2018', '#trektheat', '#thruhike', '#maine', '#bunnyrabbit']","(1) Stumbled across this today—Whoo wee, emotions<br>(2) A cool blaze climbing up Saddleback Mountain<br>(3) Ethel Pond, I believe<br>(4) A nice area of trail<br>(5) Fog lingering over The Horn<br>(6) Climbing up Saddleback Jr. Mountain<br>(7) Another cool blaze<br>(8) I think the shades of green in this picture are awesome<br>(9) Bugs<br>.<br>.<br>#atnobo2018 #appalachiantrail #atclassof2018 #trektheat #thruhike #maine #bunnyrabbit"
1795801054254179077,Bjr94tWF6MF,4108798594,86,1528296189,"['#appalachiantrail', '#appalachiantrail2018', '#atthruhike', '#atnobo2018', '#atthruhike2018', '#hikerlife', '#hikerlife', '#georgiatomaine', '#trailmagic']",Trail magic in the Shenandoah’s yesterday was amazing! Thank you so much!!! 🤗🌎🌲❤️ They plan to be there until Thursday for anyone else who will be passing by! #appalachiantrail #appalachiantrail2018 #atthruhike #atnobo2018 #atthruhike2018 #hikerlife #hikerlife #georgiatomaine #trailmagic
1795786857013237142,Bjr6qHIltWW,4108798594,71,1528294497,"['#appalachiantrail', '#appalachiantrail2018', '#atthruhike', '#atnobo2018', '#atthruhike2018', '#hikerlife', '#hiketheat', '#georgiatomaine', '#forestfire']",We looked through a lot of old photos from our trip so far and found this one from one of the forest fire sections. Definitely one of my favorites. 🌲❤️🌎 #appalachiantrail #appalachiantrail2018 #atthruhike #atnobo2018 #atthruhike2018 #hikerlife #hiketheat #georgiatomaine #forestfire
1795776020190011226,Bjr4Majlx9a,4108798594,52,1528293205,"['#appalachiantrail', '#appalachiantrail2018', '#atthruhike', '#atnobo2018', '#atthruhike2018', '#hikerlife', '#hiketheat', '#georgiatomaine', '#goshenandoah']",Beautiful sky’s in the Shenandoah’s ☺️🌲🌎❤️ #appalachiantrail #appalachiantrail2018 #atthruhike #atnobo2018 #atthruhike2018 #hikerlife #hiketheat #georgiatomaine @goshenandoah #goshenandoah
1795324797318569643,BjqRmQgn56r,254241442,109,1528239415,"['#smidgehikestheat', '#appalachiantrail2018', '#atthruhike2018', '#atnobo2018', '#possiblygiardia', '#butwhoknows', '#imtiredofshittingtho']","Day 75: Since leaving the hostel last weekend, there has been hardly any rain! Yay! It had rained every day so far that I have been in this state! The lows have definitely gotten worse, though: we had to say goodbye to our favorite trail dog, Avey (aka Princess Peach). She had to go home and her momma Reggie Rockets is sad. It wasn’t Reggie’s intention to have Avey out for her entire thru hike, but it still stinks- she was the loveliest trail dog, and asked to sit in my lap around the fire on her last night with us. Love her ❤️ Oh, and I’m also currently in a cheap motel room in Roanoke VA, recuperating after nearly 5 days of diarrhea. I wasn’t doing myself any favors by staying on the trail, so I hopped off today and went to an urgent care for a broad spectrum antibiotic and a couple days of rest in a private room. I’m looking forward to doing some trail magic tmro afternoon for hikers near Catawba! Making the best of a (literally) shitty situation! Hope to be back on trail by Friday morning. #smidgehikestheat #appalachiantrail2018 #atthruhike2018 #atnobo2018 #possiblygiardia #butwhoknows #imtiredofshittingtho"
1795263313510458891,BjqDnjQFOYL,104781845,30,1528232085,['#atnobo2018'],The iconic tree at the Georgia/North Carolina border. #atnobo2018
1795116862365213091,BjpiUZ_l6Gj,4108798594,66,1528214627,"['#appalachiantrail', '#appalachiantrail2018', '#atthruhike', '#atnobo2018', '#atthruhike2018', '#hikerlife', '#hiketheat', '#georgiatomaine', '#shenandoahnationalpark']",Beautiful 360 views this morning on the rock scramble side trail in the Shenandoah’s! 🌲🌎❤️ #appalachiantrail #appalachiantrail2018 #atthruhike #atnobo2018 #atthruhike2018 #hikerlife #hiketheat #georgiatomaine #shenandoahnationalpark @goshenandoah
1794999895489308291,BjpHuUGgOaD,18763550,92,1528200783,['#hikertrash'],"Bath time #hikertrash <br>For more videos, link in the bio"
1794504860261246875,BjnXKmnlWeb,104781845,26,1528141671,['#atnobo2018'],I used my first town stay to stay at the hiker staple Budget Inn in Hiawassee!  #atnobo2018
1794435103381547834,BjnHTgdjGs6,6635295034,157,1528133355,"['#atnobo2018', '#appalachiantrail', '#atclassof2018', '#atthruhike', '#maine', '#finalboss', '#cruisecontrol']","(1) That purple stuff<br>(2) The fog clearing for me climbing out of my zero day in Bethel, ME<br>(3) Right as the day became pretty again<br>(4) You know that old video of the car driving and you’re following it above as it drives and then that freaky zombie girl pops out and scares you? This photo reminded me of that road<br>(5) Small clearing in the trees<br>(6) A nice place to stop for a minute<br>(7) Maine boardwalks<br>(8) Where I ate dinner last night<br>(9) The view from where I ate dinner last night<br>.<br>.<br>#atnobo2018 #appalachiantrail #atclassof2018 #atthruhike #maine #finalboss #cruisecontrol"
1794431960867084452,BjnGlxxFxik,3125377700,140,1528132980,"['#withguthook', '#backpacking', '#thetrek', '#optoutside', '#hiking', '#mountains', '#at2018', '#thruhike', '#atthruhike', '#hikerlife', '#atnobo2018', '#keepitwild', '#getoutside', '#neverstopexploring', '#hiketheat', '#dirtbag', '#hikerlife', '#traillife', '#rei1440project']","""Milestone week concludes with me looking like a child playing in the dirt because that's all I'm really doing and now I'm halfway! It's reassuring to know that for every step I take forward, I'll have already taken one sometime these past two months to match."" #withguthook ⠀<br>.⠀<br>.⠀<br>.⠀<br>#backpacking #thetrek #optoutside #hiking #mountains #at2018 #thruhike #atthruhike #hikerlife #atnobo2018 #keepitwild #getoutside #neverstopexploring #hiketheat #dirtbag #hikerlife #traillife #rei1440project ⠀<br>📷: @danbrownontrail"
1794409658712443512,BjnBhPRFcp4,4108798594,48,1528130322,"['#appalachiantrail', '#appalachiantrail2018', '#atthruhike', '#atnobo2018', '#atthruhike2018', '#hikerlife', '#hiketheat', '#georgiatomaine', '#shenandoahnationalpark']",The sun came back out!! YAY!! 😁 #appalachiantrail #appalachiantrail2018 #atthruhike #atnobo2018 #atthruhike2018 #hikerlife #hiketheat #georgiatomaine #shenandoahnationalpark
1794383727762306950,Bjm7n5MA3eG,175590940,44,1528127231,"['#atthruhike', '#atnobo', '#atnobo2018', '#appalachaintrail', '#atthruhike2018', '#optoutside', '#backpacking']",My first bear encounter was not at all like I thought it would be! The bear took my food and ripped my tent! They’re a lot smarter than we give them credit for. #atthruhike #atnobo #atnobo2018 #appalachaintrail #atthruhike2018 #optoutside #backpacking
1793910961260098637,BjlQIPElnRN,4349985062,27,1528070872,"['#goodergrove', '#goodergrovehostel', '#atclassof2018', '#outsidefranklinnc', '#bartramtrail', '#zenintheforest', '#atnobo2018', '#atmile110']","Just look at this MESS! Garbage left at the Bartram Trail parking area has been here for at least two weeks. I finally had some spare time to clean it up, and the trail provided a full size garbage bag via one of two section hikers to whom I gave a ride. I like the new look better. ;)<br>#goodergrove #goodergrovehostel  #atclassof2018 #outsidefranklinnc #bartramtrail #zenintheforest #atnobo2018 #atmile110"
1793604024382319033,BjkKVt1BOm5,500648637,144,1528034283,"['#rocksylvania', '#backpacking', '#thetrek', '#optoutside', '#hiking', '#mountains', '#at2018', '#thruhike', '#atthruhike', '#hikerlife', '#atnobo2018', '#keepitwild', '#getoutside', '#neverstopexploring', '#hiketheat', '#dirtbag', '#hikerlife', '#traillife', '#rei1440project', '#withguthook']","Pennsylvania provided for some of the hardest challenges of the trail thus far. The seemingly endless rock fields left my feet and legs sore each night. More than anything, the tough terrain was mentally exhausting. The rocks really do slow you down by forcing you to constantly consider each step so as to avoid rolling your ankles. I'm happy to have made it through #rocksylvania and push onward into NJ!<br>.<br>.<br>.<br>#backpacking #thetrek #optoutside #hiking #mountains #at2018 #thruhike #atthruhike #hikerlife #atnobo2018 #keepitwild #getoutside #neverstopexploring #hiketheat #dirtbag #hikerlife #traillife #rei1440project #withguthook"
1793587236354495158,BjkGhawlZK2,218805548,17,1528032281,"['#atnobo', '#appalachiantrail', '#atnobo2018', '#georgiatomaine', '#womenwhohike', '#hike', '#optoutside', '#wild']",Found Snow White’s house yesterday<br>#atnobo #appalachiantrail #atnobo2018 #georgiatomaine #womenwhohike #hike #optoutside<br>#wild
1793583383155305609,BjkFpWMA-yJ,175590940,43,1528031822,"['#atthruhike', '#atnobo', '#atnobo2018', '#appalachaintrail', '#atthruhike2018', '#optoutside', '#backpacking']","Three down, eleven to go! #atthruhike #atnobo #atnobo2018 #appalachaintrail #atthruhike2018 #optoutside #backpacking"
1793569980256725036,BjkCmTxAags,175590940,26,1528030224,"['#atthruhike', '#atnobo', '#atnobo2018', '#appalachaintrail', '#atthruhike2018', '#optoutside', '#backpacking']",#atthruhike #atnobo #atnobo2018 #appalachaintrail #atthruhike2018 #optoutside #backpacking
1793107198949534701,BjiZX9FlSvt,104781845,28,1527975056,['#atnobo2018'],Before the rain started in Georgia a couple weeks ago!<br>#atnobo2018
1792981350090672403,Bjh8wnNDgkT,50024622,111,1527960054,"['#trektheAT', '#appalachiantrail', '#thetrek', '#georgiatomaine', '#atnobo2018', '#atthruhike', '#trekking', '#nopainnomaine', '#appalachiantrials', '#thruhike', '#at2018', '#hikertrash']",Can life get any better? 🏞<br>#trektheAT #appalachiantrail #thetrek #georgiatomaine #atnobo2018 #atthruhike #trekking #nopainnomaine #appalachiantrials #thruhike #at2018 #hikertrash
1792975033796601130,Bjh7UsslyUq,6985514346,13,1527959301,"['#optoutside', '#optoutdoors', '#atnobo2018', '#appalachiantrail2018', '#northbound']",We found this old crashed car before a shelter we stayed at#optoutside #optoutdoors #atnobo2018 #appalachiantrail2018 #northbound
1792892767036543102,BjhonjzlJB-,4108798594,36,1527949494,"['#appalachiantrail', '#appalachiantrail2018', '#atthruhike', '#atnobo2018', '#atthruhike2018', '#georgiatomaine', '#shenandoahnationalpark', '#nationaltrailsday']",Day: 81 Mile 873.5 🌲 So glad to be in the Shenandoah’s! Happy National Trails Day! #appalachiantrail #appalachiantrail2018 #atthruhike #atnobo2018 #atthruhike2018 #georgiatomaine #shenandoahnationalpark #nationaltrailsday
1792445941422496624,BjgDBZBlBtw,7347078808,7,1527896228,"['#traildays', '#gear', '#appalachia', '#appalachiantrail', '#nobo2018', '#atnobo2018', '#virginia', '#damascus', '#walkwithtarzan']",Big Party for the Hikers at Trail Days.<br>.<br>.<br>@granitegear #traildays #gear #appalachia #appalachiantrail #nobo2018 #atnobo2018 #virginia #damascus #walkwithtarzan
1792445371181733027,BjgC5F8lJSj,7347078808,5,1527896160,"['#trash', '#hikertrash', '#hikertrashforlife', '#traildays2018', '#traildays', '#appalachia', '#appalachiantrail', '#nobo2018', '#atnobo2018', '#walkwithtarzan', '#virginia', '#damascus']",This is what the hiker life really looks like.<br>.<br>.<br>#trash #hikertrash #hikertrashforlife #traildays2018 #traildays #appalachia #appalachiantrail #nobo2018 #atnobo2018 #walkwithtarzan #virginia #damascus
1792442720205614386,BjgCShCFy0y,7347078808,4,1527895844,"['#trailstyle', '#traillife', '#hikertrash', '#marylandhiker', '#appalachiantrail', '#atnobo2018', '#nobo2018', '#walkwithtarzan', '#happykav']",Man my hairs getting LONG.<br>.<br>.<br>#trailstyle #traillife #hikertrash #marylandhiker #appalachiantrail #atnobo2018 #nobo2018 #walkwithtarzan @walkwithtarzan #happykav
1792441873719610472,BjgCGMrl8xo,7347078808,2,1527895744,"['#tentcity', '#appalachia', '#appalachiantrail', '#nobo2018', '#traildays', '#tramily', '#traillife', '#hikertrash', '#atnobo2018', '#walkwithtarzan']",Day before Trail Days with Riffraff. .<br>.<br>#tentcity #appalachia #appalachiantrail #nobo2018 #traildays #tramily #traillife #hikertrash #atnobo2018 #walkwithtarzan
1792440832886083922,BjgB3DVFJFS,7347078808,5,1527895619,"['#waterfall', '#coldfeet', '#stream', '#brook', '#trailviews', '#campviews', '#appalachia', '#appalachiantrail', '#nobo2018', '#atnobo2018', '#rei', '#optoutside']",Icy water on swollen feet. Goodnight!<br>.<br>.<br>.<br>#waterfall #coldfeet #stream #brook #trailviews #campviews #appalachia #appalachiantrail #nobo2018 #atnobo2018 #rei #optoutside
1792439712931563480,BjgBmwSlsfY,7347078808,5,1527895486,"['#appalachia', '#appalachiantrail', '#tramily', '#trailpup', '#traildog', '#tennessee', '#buddy', '#hikerfriend', '#hikertrash', '#atnobo2018', '#nobo2018']",Longbird and Stella.<br>.<br>.<br>#appalachia #appalachiantrail #tramily #trailpup #traildog #tennessee #buddy #hikerfriend #hikertrash #atnobo2018 #nobo2018
1792438183595965916,BjgBQf_FX3c,7347078808,10,1527895304,"['#nobo2018', '#appalachiantrail', '#appalachia', '#atnobo2018', '#hikertrash', '#hiking', '#optoutside', '#leki']",Another in the Tennessee Hills #nobo2018.<br>.<br>.<br>#appalachiantrail #appalachia #atnobo2018 #hikertrash #hiking #optoutside #leki
1792437335230910658,BjgBEJ4lhDC,7347078808,4,1527895203,"['#traildays2018', '#appalachia', '#nobo2018', '#tennessee', '#atnobo2018', '#appalachiantrail', '#hiking', '#hiketrash', '#mileagecrusher']",Headed to #traildays2018.<br>.<br>.<br>#appalachia #nobo2018 #tennessee #atnobo2018 #appalachiantrail #hiking #hiketrash #mileagecrusher
1792357091896025310,Bjfu0ddHWDe,254241442,107,1527885637,"['#smidgehikestheat', '#appalachiantrail2018', '#atthruhike2018', '#atnobo2018', '#rainraingoaway', '#somuchgreen']","Day 71: taking a zero day at Angel’s Rest Hikers Haven in Pearisberg VA. It’s been ten days of rain, wet clothes/socks/shoes/bivy and we all needed a day of rest. We’ve covered 150+ miles in 10 days, and the rain is forecasted to last another 3-4 days. I haven’t taken many pictures due to the rain, but here are a few highlights from the last week or so: 1) a lovely suspension bridge 2) view from a powerline break above Pearisberg 3) a cute little baby rat snake on the trail between thunderstorms 4) I missed seeing a 600 mile mark, so here is a 1000km marker (~630 miles) 5) my shoes after a minor mud day 6) me and Gigs at a lookout above Pearisberg. #smidgehikestheat #appalachiantrail2018 #atthruhike2018 #atnobo2018 #rainraingoaway #somuchgreen"
1792112947516293855,Bje3TsSFkLf,2534153189,1414,1527856532,"['#appalachiantrail', '#georgiatomaine', '#atnobo2018', '#at2018', '#atthruhike', '#nopainnomaine', '#thruhiking', '#trekking', '#appalachiantrials', '#hikemoreworryless', '#getoutdoors', '#optoutside', '#forceofnature', '#trektheat', '#hyoh', '#hiking', '#adventure', '#hikingtrail', '#thruhike', '#wild', '#darntough', '#adventureanywhere', '#leavenotrace', '#takelessdomore', '#vandring', '#thruhikesyndicate']","“Climb mountains not so the world can see you, but so you can see the world.”<br>📸: @c.carns •••••••••••••••••••••••••••••••••••••••••••••••••••••••••••<br>May 30 - After a foggy morning and lots of rain the sun came out for a split second for us to check out the view and take our obligatory pic. Oh and I passed 700 miles! •••••••••••••••••••••••••••••••••••••••••••••••••••••••••••<br>#appalachiantrail #georgiatomaine #atnobo2018 #at2018 #atthruhike  #nopainnomaine #thruhiking #trekking #appalachiantrials #hikemoreworryless #getoutdoors #optoutside #forceofnature #trektheat #hyoh #hiking #adventure #hikingtrail #thruhike #wild #darntough #adventureanywhere #leavenotrace #takelessdomore #vandring #thruhikesyndicate"
1791740574840544466,Bjdio9NBlzS,500648637,112,1527812142,"['#backpacking', '#thetrek', '#optoutside', '#hiking', '#mountains', '#at2018', '#thruhike', '#atthruhike', '#hikerlife', '#atnobo2018', '#keepitwild', '#getoutside', '#neverstopexploring', '#hiketheat', '#dirtbag', '#hikerlife', '#traillife', '#rei1440project', '#withguthook']","Part time thru hiker, part time guy who just moves newts off the trail so they don't get squished.<br>.<br>.<br>.<br>#backpacking #thetrek #optoutside #hiking #mountains #at2018 #thruhike #atthruhike #hikerlife #atnobo2018 #keepitwild #getoutside #neverstopexploring #hiketheat #dirtbag #hikerlife #traillife #rei1440project #withguthook"
1791722352545361048,BjdefyXl-yY,4108798594,42,1527809970,"['#appalachiantrail', '#appalachiantrail2018', '#atthruhike', '#atnobo2018', '#atthruhike2018', '#hikerlife', '#hiketheat', '#georgiatomaine', '#hikerfeet']","This is the result of having to wear wet socks three days in a row 😣 we tried to dry our stuff out, even tried to heat up our socks with our stove but burned holes in them instead 😩 So thankful to be in town & DRY! (The first photo was taken with 5 miles left to hike into town. The second photo is after 6 hours of drying out.) #appalachiantrail #appalachiantrail2018 #atthruhike #atnobo2018 #atthruhike2018 #hikerlife #hiketheat #georgiatomaine #hikerfeet"
1791626474815459488,BjdIslRj5Cg,6635295034,142,1527798640,"['#atnobo2018', '#appalachiantrail', '#atclassof2018', '#atthruhike', '#tourguide']","Yo, Walkie Talkie (@merkel.mumps), when you get to Maine, the grouse give you the guided trail tour, not porcupines<br>.<br>.<br>#atnobo2018 #appalachiantrail #atclassof2018 #atthruhike #tourguide"
1791619086189296136,BjdHBEFH3oI,4188351129,11,1527797660,"['#appalachiantrail', '#atnobo2018']",Living the dream one peak at a time #appalachiantrail #atnobo2018
1791494992293713884,BjcqzQojtfc,6635295034,150,1527782866,"['#atnobo2018', '#appalachiantrail', '#atclassof2018', '#atthruhike', '#trektheat', '#maine', '#birdup']","People don’t think Maine be like it is, but it do<br>.<br>.<br>#atnobo2018 #appalachiantrail #atclassof2018 #atthruhike #trektheat #maine #birdup"
1791039287204424740,BjbDL4Mlqwk,4108798594,54,1527728542,"['#appalachiantrail', '#appalachiantrail2018', '#georgiatomaine', '#hikerlife', '#hiketheat', '#atthruhike', '#atnobo2018', '#mountains']",😲 #appalachiantrail #appalachiantrail2018 #georgiatomaine #hikerlife #hiketheat #atthruhike #atnobo2018 #mountains
1791027852634111732,BjbAle7Fj70,4108798594,33,1527727179,"['#appalachiantrail', '#appalachiantrail2018', '#atthruhike', '#atnobo2018', '#atthruhike2018', '#hiketheat', '#hikerlife', '#georgiatomaine', '#hitchhiking']","Riding in style to and from town! See the video on our Facebook, link in bio. #appalachiantrail #appalachiantrail2018 #atthruhike #atnobo2018 #atthruhike2018 #hiketheat #hikerlife #georgiatomaine #hitchhiking"
1790995623249883772,Bja5Qe-FrJ8,4108798594,63,1527723337,"['#appalachiantrail', '#appalachiantrail2018', '#atthruhike', '#atnobo2018', '#atthruhike2018', '#hiketheat', '#hikerlife', '#georgiatomaine', '#800miles']",Day 79: mile 846.6 (Current location) So.. a lot of things have happened since our last post. We had a few very hot days followed by nonstop spontaneous rain from the recent tropical storm on the east coast. After a few days of being soaked to the bone we are all ready to be in town! Oh and meet our buddy Stretch! We have been hiking together for over 500 miles!! Waynesboro here we come! 😊 #appalachiantrail #appalachiantrail2018 #atthruhike #atnobo2018 #atthruhike2018 #hiketheat #hikerlife #georgiatomaine #800miles
1790793997670967595,BjaLachFGkr,7095020456,20,1527699301,"['#chasingblazes', '#AT2018', '#appalachiantrail', '#appalachiantrail2018', '#atthruhike', '#thruhike2018', '#georgiatomaine', '#atnobo2018', '#thetrek', '#trektheat']","It’s been a fun wet week back on trail after our trip back home! We had a slow start from standing bear with an overnight stomach bug our first two days. We saw our first bears 🐻!! A momma and her cub sprinted across the trail about 30 feet in front of me. (Not gonna lie, scared the crap out of me 😂) we made it back to Hot Springs to get out of the rain and nurse a possible sprained ankle. I’m hoping the rest and ice helped and it doesn’t get any worse. Glad to be headed back out today. Hopefully the rain will die out soon! #chasingblazes#AT2018#appalachiantrail#appalachiantrail2018#atthruhike#thruhike2018#georgiatomaine#atnobo2018#thetrek#trektheat"
1790749704712184618,BjaBV5fAWMq,24370573,93,1527694021,"['#WalkThePark', '#15', '#appalachiantrail', '#atnobo2018', '#allwedoiswin', '#funtimes', '#shenandoah', '#shenandoahnationalpark', '#skylinedrive', '#virginiaisforlovers', '#shennies', '#atthruhike', '#thruhike', '#backpacking']",#WalkThePark hits park #15!!! Shenandoah National Park!  It’s so green here!  On to Acadia!  #appalachiantrail #atnobo2018 #allwedoiswin #funtimes #shenandoah #shenandoahnationalpark #skylinedrive #virginiaisforlovers #shennies #atthruhike #thruhike #backpacking
1790731327286155285,BjZ9KeLDhgV,6635295034,185,1527691831,"['#atnobo2018', '#appalachiantrail', '#atclassof2018', '#trektheat', '#atthruhike', '#thruhike', '#maine']",Maine is Bowser’s Castle of the AT—The Final Boss<br>.<br>.<br>#atnobo2018 #appalachiantrail #atclassof2018 #trektheat #atthruhike #thruhike #maine
